productId,productName,categoryName
B0BMV4HTSG,"Watris Veiyi 2PCS Luggage Wheels Replacement, Left and Right Suitcase Wheels Replacement, Wheel Spare Part for Luggage Suitcase, 4.3 x 3.9 in (Non-Universal, Please Check The Dimensions Carefully)",Suitcases
B099WJ71B7,"Carry on Luggage, Mixi Suitcase Spinner Wheels Luggage Hardshell Lightweight Rolling Suitcases PC with Cover & TSA Lock for Business Travel",Suitcases
B09WCWCYV2,"Eco Tough 30"" Hardside Checked 8 Wheel Expandable Spinner, Silver Lining",Suitcases
B09XDPT9H8,"Luggage Suitcase Replacement Wheel, Universal 360 Degree Swivel Caster Spinner Wheel Black Plastic Travel Luggage Trolley Spare Rotating Wheel for Outdoor Repair Replacement",Suitcases
B0CCRDFB5P,"Luggage Covers for Suitcase Protector Tsa Approved Fits 18-32 Inch Luggage, Custom Baggage Cover for Travel Anti Scratch Dirt Washable. S/M/L Sets",Suitcases
B071VMQBKP,"Tie-Dye Swirl Rolling Suitcase, Hardside Travel Luggage with Spinner Wheels, 24 Inches, Rainbow",Suitcases
B0C29D7H4Q,Clear PVC Suitcase Cover Protectors Luggage Cover for Wheeled Suitcase (20inch/24inch/28inch (3 Pieces)),Suitcases
B0B4QVLV5J,"Jupiter 28"" Hardside Checked 8 Wheel Expandable Spinner, Red",Suitcases
B084WWTYQC,"Luggage Cover Suitcase Protector Fits 19-33 Inch TSA Approved Travel Suitcase Cover Washable Dustproof Anti-Scratch (L (26-30 inch), License Plates)",Suitcases
B0BZBVK7X7,"Travel Luggage Cover Suitcase Protector, Tropical Beach Palm Tree Washable Elastic Suitcase Baggage Cover Anti-scratch Double-sided with Zipper Closure for Wheeled Suitcase Fits 25-28 Inch Luggage",Suitcases
B00BNTR6J0,"24 Inch 8 Wheel Spinner, Olive Green, One Size",Suitcases
B09R3VB6M4,"Malibu Bay 3.0 Softside, 4 Wheel Spinner, Lightweight Suitcase, Unisex, Stylish, Blue, Checked-Medium 25-Inch",Suitcases
B09WCYRVFL,Travel Suitcase Protector Light skin african american Elastic Protective Washable Luggage Cover With Concealed Zipper Suitable For 18-32 Inch (L (for 25--28 inch luggage)),Suitcases
B00GCB69ZG,"Conventional II Expandable Rugged Rollaboard Luggage, Red, Checked-Medium 25-Inch",Suitcases
B0BH6Q6RDG,"Queensbury Softside 24"" Expandable Spinner, Rose Gold",Suitcases
B09Z7JFNXT,"Attuned 32"" Hardside Checked 8 Wheel Expandable Spinner, Charcoal",Suitcases
B07SHHRTNM,"Softside Spinner Luggage, Black Menswear Plaid, Checked-Medium 24-Inch",Suitcases
B0BZC3NLKQ,"Luggage Suitcase with Spinner Wheels, Hardside Checked Luggage with TSA Lock, 24 Inch Medium Travel Suitcase (GREY,4PCS)",Suitcases
B0C92JFYCH,"Spontaneous 31"" Hardside Checked 8 Wheel Expandable Spinner, Black",Suitcases
B0BZC6NP3C,"Luggage Suitcase with Spinner Wheels, Hardside Checked Luggage with TSA Lock, 24 Inch Medium Travel Suitcase (YELLOW,4PCS)",Suitcases
B09RSHJD39,"Jessica Hardside Expandable Luggage with Spinner Wheels (Black, Checked-Medium 25-Inch)",Suitcases
B07QBZGT45,Clear PVC Suitcase Cover Protectors 20 22 24 26 28 30 Inch PVC Transparent Travel Luggage Protector for Carry on,Suitcases
B0CG2847WS,Alphabet Decorative R Suitcase Protectors Elastic Washable Luggage Covers With Concealed Zippers For 18-32 Inch Luggage (Size L: Fits 25-28 Inch),Suitcases
B0C9MDVSV2,Luggage Cover Set Clear PVC Luggage Cover & 2-in-one Luggage Strap Thickened Suitcase Cover 30 Inch Luggage Protector for Wheeled Suitcase (30-Inch),Suitcases
B0846JMZKJ,"Unisex Adult Spinner S (55 cm-36 L), Multicolour (Donald Blue Kiss)",Suitcases
B0B2LQLSXF,Washable Elastic Cartoon Pink Cat Luggage Cover Travel Suitcase Protective Cover Trunk Case Fits 18''-32'' Suitcase Protector Baggage With Concealed Zipper Gifts for Women Cat 1 Large,Suitcases
B09NYHTP8K,"Multihole Suitcase Wheel,A Pair A88 Black Luggage Multihole Wheel Universal Suitcase Replacement Outdoor Supplies",Suitcases
B0BCPMPMZ5,"Sheen 28"" Hardside Checked 8 Wheel Expandable Spinner, Marmo Rose Print, 27""",Suitcases
B0B3XM981Q,Purple Suitcase Cover Elastic Luggage Cover Black Protector Fits 30-32 Inch Luggage - Excluding Suitcase,Suitcases
B07WCQT2JH,Near Spinner Unisex Small Grey Polypropylene Luggage Bag TSA Approved AY8014001,Suitcases
B0BN4MGMXJ,"Margot Hardside Expandable Luggage with Spinner Wheels, Black, Checked Large 28 Inch",Suitcases
B0CJ8MZ152,"2PCS Suitcase Cover, 28 Inch Clear PVC Luggage Cover Protector for Wheeled Suitcase (28 Inch)",Suitcases
B0BDVN579X,X-Bag Large Spinner with Frame - 30 Inch - Suitcases with Wheels - Checked Luggage - Cappuccino,Suitcases
B0CG6C6JKM,"28"" Checked Luggage, Airline Approved Spinner Suitcase with Wheels, Hard Shell Expandable Carry on Luggage for Business/Travel(White)",Suitcases
B0BM3YCT2G,Utility Duffel,Suitcases
B0B84CDVKG,"28 Inch Dust-proof See Through Luggage Cover Protector Bag PVC Full Clear Suitcase Cover Protectors Waterproof Transparent Travel Luggage Sleeve (28""=24.5"" H x 19.6"" L x 11.7"" W)",Suitcases
B07284TW5Q,"ful Tie-Dye Swirl Rolling Suitcase, Hardside Travel Luggage with Spinner Wheels, 28 Inches, Rainbow",Suitcases
B0BTYZR67H,"Suitcase Caster, 1 Pair Luggage Swivel Wheels Suitcase Casters Repalcement A19 Mute Double Row, RiToEasysports0bsz8rfg1k",Suitcases
B09VD9FGDH,"Quaint 31"" Hardside Checked 8 Wheel Expandable Spinner, Cobblestone with Mulch Trim",Suitcases
B01HFH41RS,Steve Madden Designer Luggage Collection - Expandable 24 Inch Softside Bag - Durable Mid-sized Lightweight Checked Suitcase with 4-Rolling Spinner Wheels (Global Black),Suitcases
B0BHBSJGCS,"DC Comics Batman 25 Inch Rolling Luggage, Molded Hardshell Suitcase with Spinner Wheels, Black (FKML0003-001)",Suitcases
B0B4272WG6,"GinzaTravel New Classic Aluminum Frame Fashion Bright Color Suitcase with TSA Lock No Zipper（Colorful Series） (Gold, Checked-Large 28"")",Suitcases
B07GBTWJSS,"Wildkin Kids Rolling Suitcase for Boys & Girls, Suitcase for Kids Measures 16 x 11.5 x 6 Inches, Kids Luggage is Carry-On Size, Perfect for School & Overnight Travel (Trains, Planes & Trucks)",Suitcases
B01H5M0OE2,Cute 3D Luggage Protector Suitcase Cover 18-32 Inch,Suitcases
B08T8VHCY1,Vintage Women Suitcase 26 inch Lightweight PU Trolley Luggage with Spinner Wheels (Pink Floral),Suitcases
B0BWH4ZW55,3 Pcs Suitcase Covers Protective Washable Suitcase Protector Anti Scratch Luggage Cover Protector for 18-28 Inch Luggage (Floral),Suitcases
B079SGFPSD,"Atlantic Ultra Lite Hardside Expandable Spinner, Jade Black, Checked Large 28-Inch",Suitcases
B0BT7S7ZKJ,"Re:serve Check-In 26"" Spinner, Made from Recycled Materials, Grey",Suitcases
B09JSMT65C,28 Inch Luggage – Expandable Durable Softside Lightweight Suitcase with 8-Wheel Spinners Large Checked-Size Bag purple,Suitcases
B08HX2K46B,RiToEasysports 1 Pair Replacement Mute Luggage Wheels Suitcase Wheels for Suitcase Parts,Suitcases
B0776WM58D,"Unisex-Adult's Hand Luggage, Anthrazit, 55cm",Suitcases
B0B9M7MXN1,"Luggage Cover, Clear Suitcase Cover Luggage Protector, Waterproof PVC Suitcase Cover for Wheeled Suitcase (28 inch)",Suitcases
B0BZWK2Q12,African American Ballerinas Thick Trolley Luggage Protective Cover Ballerina girl Elastic Suitcase Cover Fit 22-24 Inch Luggage,Suitcases
B06XJ8DD3C,"920 Heavy Duty Protective Dry Box Case With Accuform Foam - TSA Approved/Mil Spec / IP67 Waterproof/USA Made for Scuba Gear, Gaming Rigs, Sound Equipment, Travel",Suitcases
B079M59MSH,Soundbox - Spinner,Suitcases
B0C24SJS3S,"Northbridge 24"" Expandable Hardside Spinner Midnight, 24 Inch",Suitcases
B0BZJ9FNSX,Luggage Protector Suitcase Cover Travel Suitcase Cover Baggage Covers Fit 25-28 Inch Red Bow,Suitcases
B010WU9LVG,Epic Softside Large Check-in,Suitcases
B074QMLG8K,"Crimson 21"" Hardside Carry-on Spinner Luggage, Telescoping Handles, Black, One Size",Suitcases
B0BX6QG799,"Self-Charging Suitcase By 2 Kinetic Wheels with 5000mAh Removable Portable Charger, Durable Travel Hardside Carry On Luggage 22x14x9 Airline Approved with USB Port (Sharp Black)",Suitcases
B00ILY5G3I,"Revolution Plus 29 Inch Expandable Spinner with Suiter, Cobalt Blue, One Size",Suitcases
B0CFMXSNK2,"Luggage Protector Case Clear PVC Suitcase Cover - Dustproof, Waterproof, Scratch-Resistant Luggage Covers for Suitcase, Clear Luggage Protector Cover(30inch-27.6''H * 20.7''L * 13''W)",Suitcases
B0CC5MN319,Suitcase Cover Luggage Elastic Luggage Cover Suitcase Protector Baggage Cover for 32 Inch Black,Suitcases
B0897D7TM8,"Elastic Travel Luggage Cover Travel Suitcase Protective Cover for Trunk Case Apply to 19''-32'' Suitcase Cover (T2088, XL)",Suitcases
B0BZCV2MCL,"Travel Luggage Cover Suitcase Protector Washable Anti-scratch Baggage Covers (World Stamp, M(22-24in))",Suitcases
B0CCJGNJ2C,"Luggage Expandable(only 28"") Suitcases with Spinner Wheels PC+ABS Hardshell TSA Lock 28Inch Pink",Suitcases
B0B994KW8R,"Eco-Protect 27"" Hardside 8 Wheel Expandable Spinner, Green",Suitcases
B01KA2Y760,"Alex - Set of 3 Hard-side Luggages Trolley Suitces Expandable, TSA, (S, M & L), dark blue",Suitcases
B0BQQPNB5C,Flower Lette A Pink Luggage Cover Elastic Washable Stretch Suitcase Protector Anti-Scratch Travel Suitcase Cover for Kid and Adult M (22-24 inch suitcase),Suitcases
B0BQB4KTKL,Pink Gold Marble Luggage Cover Elastic Washable Stretch Suitcase Protector Anti-Scratch Travel Suitcase Cover for Kid and Adult XL (29-32 inch suitcase),Suitcases
B0C8WMXHW3,"Women's Hardside Rolling Suitcase Luggage, Fresh-Cut Floral Green, 29"" Check in",Suitcases
B07WT6926N,"Queensbury Softside Spinner Luggage, Navy, Checked-Large 28-Inch",Suitcases
B0771JPT1D,Tranverz L - Sunday Grey,Suitcases
B09VYKZBJF,"Lineal 28"" Hardside Checked 8 Wheel Expandable Spinner, Oyster Grey",Suitcases
B00BV5M8OY,"28 Inch 8 Wheel Spinner, Olive Green, One Size",Suitcases
B0B3RTKHTL,"24-inch Aluminum-Magnesium Alloy Carry-on Luggage Hardside Suitcase, Built-In TSA Lock, Zipperless Fashion with Spinner Wheels for Travel/Business, Silver",Suitcases
B09VYM1135,"Legion 28"" Hardside Checked 8 Wheel Expandable Spinner, Silver",Suitcases
B0BWR6VH6B,Clear PVC Suitcase Cover Protectors 20/24/26/28/30 Inch Suitcase Baggage Covers - Waterproof Dustproof and Anti-Scratch 20-30 Inch Luggage Cover (28inch),Suitcases
B0CCL9YNY9,Luggage Wheel Covers 8Pack Carry on Luggage Wheel Protective Covers for Most 8-Spinner Wheels Travel Luggage Cover (Black),Suitcases
B0BY5VM54H,"Luggage Cover Washable Suitcase Cover Suitcase Protector Anti-scratch Suitcase cover Fits 18-32 Inch Luggage (Venice-12,S fit 18-21inch)",Suitcases
B0BFK72W1W,"Elevate 28"" Hardside Checked 8 Wheel Expandable Spinner, Ice Blue",Suitcases
B09BVPL6GR,Clear PVC Suitcase Cover Protectors 20 22 24 28 Inch Luggage Cover for Wheeled Suitcase (28Inch),Suitcases
B0BZ8L4K87,Travel Luggage Cover I TSA approved Suitcase Protector I Luggage Covers for Suitcase I Suitcase cover Bag I Luggage protector I Durable & Washable I carry on luggage cover protector,Suitcases
B0C2HSYP9Y,"3 Pcs PVC Luggage Cover Waterproof Transparent Suitcase Cover Thicken Luggage Protector for Travel, Fits 20"" 24'' 28"" Luggage (Navy Blue)",Suitcases
B0C3C7CBCC,"Luggage Sets 3 Piece, All Expandable Suitcase Set, PC Hard Case Luggage with TSA Lock Spinner Wheels YKK Zippers, 20in 24in 28in (Green)",Suitcases
B0CD3K966Q,Zoofen Luggage Wheels Replacement Black Suitcase Wheels Replacement Suitcase Caster Wheels with 2 Screw Holes(Z-237),Suitcases
B0C48W5JR4,28 Inch Luggage with Spinner Wheels Softside Expandable Large Suitcase,Suitcases
B09C4FB4VB,Luggage Cover 20 22 24 28 Inch Suitcase Cover Rolling Luggage Cover Protector Clear EVA Suitcase Cover for Carry on Luggage(22Inch),Suitcases
B07DM2ZKDQ,"S'Cure DLX Spinner 55, 2.9 KG Hand Luggage, 55 cm, 34 liters, Black (Black/Gold Deluscious)",Suitcases
B07BXHRWTG,"Spandex Travel Luggage Protector Suitcase Cover Fit 23-32 Inch Luggage (sloth, L)",Suitcases
B09VSGPYWB,"Accuracy 32"" Softside Checked 8 Wheel Spinner, Grey Skin",Suitcases
B0C8CRGJ66,"GinzaTravel Trunk Luggage 26 Inch suitcase with Spinner Wheels Scratch resistant texture Lightweight PC material with TSA Lock (Black, 26 inch)",Suitcases
B09XJKC1HH,"Momentous 25"" Hardside Checked 8 Wheel Expandable Spinner, Tibet Lan",Suitcases
B0BN6R41M9,"Census 28"" Softside Checked 8 Wheel Spinner, Grey Skin",Suitcases
B0C82PLGFW,"Printed Luggage Cover, Blue/Orange Ombre, Medium",Suitcases
B07JZFMNSL,"Soho 24"" 8-Wheel Spinner Luggage, Navy Red",Suitcases
B09XR5LYM3,"PC+ABS Durable Japanese Luggage, Expandable with double-wheeled spinner, checked-large suitcase, 30 inch, Black, 5109-69-BK",Suitcases
B07937F7F9,"Ziplite 3.0, 20"" Carry-on, Hardside Spinner Luggage (Caribbean Blue)",Suitcases
B0BYYXTB21,"Rolling suitcase, Carry-On Luggage Hardside Expandable Luggage with Spinner Wheels Checked-Medium 24 Inch Red",Suitcases
B0C7KZX98Z,"Luggage Nomad Rolling Hardside Spinner Suitcase with Wheels for Women and Men, Lightweight Travel Hard Shell Roller, Ultra Strong and Durable, Premium Polycarbonate, Burgundy, Large",Suitcases
B0C77WR5YN,"Designer Luggage Collection - Lightweight 24 Inch Expandable Softside Suitcase - Mid-size Rolling 4-Spinner Wheels Checked Bag (Black, 24in)",Suitcases
B0BZC7Y6FB,"Luggage Suitcase with Spinner Wheels, Hardside Checked Luggage with TSA Lock, 24 Inch Medium Travel Suitcase (WIHITE,4PCS)",Suitcases
B0B693RRSS,Bling Butterfly Luggage Cover Suitcase Protector Fits 18-32 Inch Travel Suitcase Cover Washable Dustproof Anti-Scratch,Suitcases
B0BHQV6B6F,"1 Pair Luggage Suitcase Wheel, A08 Trunk Luggage Wheel Spare Part (W041-2 Small) Plastic 360 Swivel Universal Wheel Replacement Luggage Wheel for suitcases/Draw Bar Box",Suitcases
B084V45NNX,"Big, Light Blue, 56x80x29 Centimeterss",Suitcases
B09DFPT58F,2Pcs 360 Swivel Suitcase Caster Wheels with Screw 2 inch Black Large Wear Resistant Wheel Outdoor Luggage Travel Suitcase Wheels Replacement for W041-2 Suitcase Repair,Suitcases
B0C1RGK1BP,Rubber Duck Elastic Travel Luggage Cover Travel Suitcase Protective Cover For Trunk Case Apply To 19''-32'' Suitcase Covermedium,Suitcases
B083HQYJLT,SHOWKOO Luggage Suitcase Replacement Wheels Rubber Swivel Caster Wheels Bearings Repair Accessories (007),Suitcases
B0BYCFWWC3,Zoofen Luggage Wheels Replacement Black Suitcase Wheels Replacement Suitcase Caster Wheels with 5 Screw Holes(Z-366),Suitcases
B0B2ZP4WS8,"St Tropez Trois 30"" Hardside Checked 8 Wheel Expandable Spinner, Black",Suitcases
B089T7VY7N,"Capri 2.0 27""-Inch Spinner - Expandable Luxury Carry On Luggage With Spinner Wheels - Lightweight Carry On Suitcases with Wheels Made From Durable Polycarbonate - Bordeaux",Suitcases
B0B46JYCY9,"Suitcase Wheel, 1 Pair Luggage Replacement Wheel Luggage Suitcase Caster Swivel Universal Wheel Nylon for Repair Replacement Black",Suitcases
B0B994S1MZ,"Eco-Protect 31"" Hardside 8 Wheel Expandable Spinner, Green",Suitcases
B0B2ZB2JW1,"St Tropez Trois 26"" Hardside Checked 8 Wheel Expandable Spinner, Metallic Rose Gold",Suitcases
B0BYYXHC38,Luggage Cover Cow Print Elastic Travel Luggage Cover Suitcase Protective Cover Washable Anti-Scratch Suitcase Cover For 22-24 Inch Luggage,Suitcases
B0BXWKRKQ1,"Luggage Covers for Suitcase, 18 20 22 24 Inch Full Transparent Suitcase cover, Clear PVC Thicken Travel Luggae Protector Cover (22 Inch)",Suitcases
B07Q89QFZX,"Replacement Luggage Suitcase Wheels, 360 Degree Swivel Caster Wheel Outdoor Luggage Travel Suitcase Wheels Replacement Wheel for Suitcase Repair (Hole Pitch 36/36/42/50mm)",Suitcases
B08F2W3M1T,"Securitime Expandable Luggage with Spinner Wheels, Silver, Checked-Medium 25 Inch",Suitcases
B0CGLJC4K7,"Spandex Travel Luggage Cover Cute Pink Suitcase Protector Bag,Black Letter N With Boho Floral Flowers Leaves Double-Sided Print Anti-Scratch,Dust-Proof Washable Suitcase Sleeve For Wheeled Suitcase Kid Adult,S (For 18-21 Inch Luggage)",Suitcases
B0BRGBPFSV,"PVC Luggage Cover, Waterproof Suitcase Cover, Clear Luggage Cover for Suitcase TSA Approved, Dustproof Travel Luggage Sleeve Protector for Wheeled Luggage (28 inch)",Suitcases
B076651LJD,Luggage Rainbow Collection - 2 Piece Hardside Lightweight Spinner Suitcase Set - Travel Set includes 20-Inch Carry On and 24 inch Checked suitcases (Lavender)…,Suitcases
B0CCFLSZF8,Real Clear Rimless Suitcase Cover - 20 22 24 26 28 30 Inch PVC Transparent Clear Travel Luggage Covers - Waterproof Dustproof Protective Suitcase Protectors (28 Inch),Suitcases
B0B6QSZLBD,"1 Pair A65 Luggage Replacement Wheels,Mute Swivel Suitcase Luggage Caster Wheels Repair Parts",Suitcases
B0BZC4X1WB,"Luggage Suitcase with Spinner Wheels, Hardside Checked Luggage with TSA Lock, 24 Inch Medium Travel Suitcase (BLACK,4PCS)",Suitcases
B08PM9M6L8,Designer Luggage Collection - Lightweight 28 Inch Expandable Softside Suitcase - Durable Rolling 4-Spinner Wheels Checked Bag (Shadow Purple) (Shadow Purple),Suitcases
B07QMLRWD5,"TRAVELKIN Travel Elastic Spandex Suitcase Protector Case, 18/24/28/32 Inch Suitcase Protective Cover, Thickened and Washable Luggage Cover (L(25""-28""luggage), Moonlight)",Suitcases
B0C373GGBD,"12 Pcs Clear PVC Suitcase Cover Waterproof Luggage Cover Large Travel Luggage Cover Protector for 28 Inch 24 Inch 20 Inch Wheeled Suitcase, 3 Sizes",Suitcases
B0B147LRTW,"Nimbus 4.0 Expandable, Durable Hardside, 4 Wheel Spinner, Lightweight Suitcase, Unisex, Stylish, Gray Sandstone, Checked-Medium 24-Inch",Suitcases
B0CFB7PW15,Clear Suitcase Cover - 20 22 24 26 28 30 Inch Suitcase Covers - PVC Waterproof Luggage Cover - Top and Side Handle Gap Suitcase Protector (30 Inch),Suitcases
B0BZ84D2P5,Travel Luggage Cover Airplane Theme Suitcase Cover Elastic Washable Dustproof Anti-Scratch Stretch Suitcase Cover for Luggage Wheeled Trunk Case Fits 18-34 Inch Baggage Covers(L (25-28 Inch luggage)）,Suitcases
B01N4ESLFO,"Suitcase, Graphite, 55 cm",Suitcases
B09VD9RRPS,"Quaint 27"" Hardside Checked 8 Wheel Expandable Spinner, Black with Almond Trim",Suitcases
B0C1B4DFJC,"Luggage set 24 In Checked Suitcase with Spinner Wheels Hardside Luggage 8PCS Set Lightweight PP Durable Luggage with TSA Lock(Grey,24 Inch)",Suitcases
B0BBGCFP3L,"28 inch Luggage with Spinner Wheels, Large Checked Luggage with TSA Lock, Hard Case Luggage with Expandable, White Lightweight Luggage",Suitcases
B0BXL7N3LH,"Travel Luggage Cover Spandex Suitcase Protector Washable Baggage Covers (for 18-30 inch luggage) Premium Elasticated Luggage Protector -Go Travel (Black, L（26-28 inches）)",Suitcases
B0C6WWPNBZ,"Travel Luggage Cover Suitcase Cover Protector Anti-scratch Suitcase Cover Fits 18-32 Inch Luggages (Black, L(27-30 inch luggage))",Suitcases
B0B3LHSHZN,"Expectant 22"" Softside Checked 8 Wheel Spinner, Black",Suitcases
B07G5MP7C3,"Travel Luggage Cover - Suitcase Cover - Luggage Covers for Suitcase (L(25""-28"" luggage), Europe)",Suitcases
B092LN24RM,"Vintage Carry on Luggage, 20"" Faux Leather Women Cute Suitcase, TSA-Approved Retro Trunk with Spinner Wheels (Embossed Pink)",Suitcases
B07XKT7QJ9,Travel Dust-proof Suitcase Cover Sunflower Print Clear Luggage Cover Protector Tsa Approved for 18-22inch,Suitcases
B01ET5EML4,"Nova Hardside Spinner Check in Luggage 29"", Black, One Size",Suitcases
B09194Q8N9,Travel Suitcase Protector African American Girl Elastic Protective Washable Luggage Cover With Concealed Zipper Suitable For 18-32 Inch -L(A little large),Suitcases
B084MHG7GG,"Ravel Luggage Cover, Suitcase Protector Bag Fits 18-34 Inch Luggage …",Suitcases
B079SFC81T,"Luggage Atlantic Ultra Lite Hardside Expandable Spinner, Turquoise Blue, Checked Large 28-Inch",Suitcases
B09QBR3KC7,"Epic 2.0 Hardside 4 Wheel Spinner, Lightweight Suitcase, Unisex, Stylish, Midnight, Checked-Large 28-Inch",Suitcases
B0C39KXZ3K,Purple Skull Flowers Suitcase Cover Anti-Scratch Luggage Covers Washable Travel Luggage Protector XL Fit 29-32 Inch Luggage,Suitcases
B0BRP1X6KJ,"Simultaneous 27"" Softside Checked 8 Wheel Expandable Spinner, Black",Suitcases
B01H5PWGLS,Luggage Collection - 24 Inch Scratch Resistant (ABS+PC) Hardside Mid-sized Suitcase - Durable Lightweight Bag with 8-Rolling Spinner Wheels (Diamond),Suitcases
B0B2X39WT9,Suitcase Cover Protectors 24 28 30 Inch Luggage Cover Elastic Travel Trolley Protector L Fit 26-28 Inch Suitcase Black,Suitcases
B0CFHCPNLJ,"8 Pack Luggage Suitcase Wheels Cover, Silicone Heavy Duty Covers for Caster Wheels, Luggage Wheels Cover for Desk Protectors (Grey)",Suitcases
B07R8Q5J1Y,"GOXUNYUAN Luggage Cover, THome Protective Washable Suitcase Cover - Travel Elastic Spandex Suitcase Protector Fits 30 to 32 Inch Black",Suitcases
B0C74CR235,Luggage Cover Protector Travel Suitcase Covers Protective Skin for Carry On Baggage Fit 29-32 Inch Luggage,Suitcases
B09DD1S1R1,2Pcs Black Luggage Suitcase Weels Suitcase Caster Wheels Replacement W076 3.74x3.93x2.04Inch,Suitcases
B0BXWRYLZS,20 inch Hand Luggage R018# Trolley Telescopic Handle with Wheels for Travel Auto Moving Use,Suitcases
B0C55J7PDK,"Clear PVC Suitcase Cover Protectors Thicken Luggage Cover Protector Full Transparent Luggage Cover Waterproof Wheeled Suitcase Cover Dustproof Luggage Sleeve Protector (26"")",Suitcases
B0C3X82D7X,"Kids Video Game Luggage Covers Colorful Gaming Gamer on Black Suitcase Covers for Luggage, Fun Gaming Gifts for Girls Boys, Elastic Print Baggage Case Suitcase Protector Fits 18-21 Inch",Suitcases
B0039DYZFQ,"T.z Apl-410t Sd Wheeled Pilot Case, 18-1/4 X 8 X 13-3/4 in, Silver, One Size",Suitcases
B0B21441ZS,"Clear PVC Luggage Cover 2 Pcs Large Suitcase Cover Protectors Transparent Protective Luggage Protector for Travel Suitcases Bags (20 Inch, 28 Inch)",Suitcases
B0BHQQXG9M,"Suitcase Cover Clear PVC Luggage Protector Cover Transparent Travel Luggage Covers for Suitcase waterproof Wheeled Suitcase Cover (28"")",Suitcases
B0C6XPP58H,"Luggage Covers for Suitcase TSA Approved,Elastic Washable Suitcase Cover Protector, Bald Eagle with Flag Luggage Cover Sleeve Wrap for 19/20/ 21 Inches Suitcase Travel Accessories",Suitcases
B0B2LPZGBB,Washable Elastic Cartoon Pink Cat Luggage Cover Travel Suitcase Protective Cover Trunk Case Fits 18''-32'' Suitcase Protector Baggage With Concealed Zipper Gifts for Women Girls Map 4 Medium,Suitcases
B0BB3361JY,"Horoper Caster Wheels, 1 Pair Luggage Whirling Wheels, Suitcase Whirling Casters Repalcement, A19 Mute Double Row Wheels for Luggage",Suitcases
B0771LVB9R,Tranverz M - Sunday Grey,Suitcases
B09PDPZW8D,Rock and Roll Skeleton Skull Boho Hippie Pattern Travel Luggage Cover Suitcase Protector Elastic Baggage Covers with Washable Zipper Dustproof M for 22-24 inch luggage,Suitcases
B07M6N6X7F,Luggage Cover Vibrant Peacock Feather Suitcase Protector Travel Fits 18-32 Inch Luggage,Suitcases
B09TZYYHCZ,"2PCS Clear PVC Suitcase Cover Protectors Transparent Luggage Cover Waterproof Wheeled Suitcase Dust Cover Dustproof Travel Luggage Sleeve Protector (24""+28"")",Suitcases
B0085K5714,S'Cure Medium Trolley Drive 4 Wheel,Suitcases
B06XDZ4ZWG,"Travelling Luggage Cover Washable Suitcase Protector Anti-scratch Suitcase cover Colorful Luggage suitcase protective cover Fits 18-30 Inch (M (22""-26"" Cover), 08)",Suitcases
B0BN6VQ5VK,"Census 27"" Softside Checked 8 Wheel Spinner, Soft Pink, 28""",Suitcases
B0B2LPQ1NF,Washable Elastic Cartoon Pink Cat Luggage Cover Travel Suitcase Protective Cover Trunk Case Fits 18''-32'' Suitcase Protector Baggage With Concealed Zipper Gifts for Women Girls Color 2 Medium,Suitcases
B07JJBDP68,"Sidewinder Expandable Hardshell Suitcase with TSA Lock, Available in 3-Piece Luggage Set/21-inch/25-inch/29-inch, Navy",Suitcases
B09Z1YPV7L,"Sea Turtle Beach Travel Suitcase Cover, Ocean Animals Washable Luggage Cover XL - Fits 29-32 inch luggage",Suitcases
B0CD45SYHH,Travel Luggage Suitcase Protector Fits 30 Inch Luggage Clear PVC Suitcase Cover Protectors for Wheeled Suitcase (30-Inch),Suitcases
B08GV38JMC,"Women's Darcey Medium 26-Inch Softside Checked Rolling Luggage, 360 Degree Spinning Wheels, Starry Gold Metallic, 13.75''L x 21.75''H x 8''D",Suitcases
B0157VQC0I,"Irvine Hardside Spinner Wheel Luggage, Champagne, 19"", 23"", 27""",Suitcases
B0BKLSZBFH,"Christian Siriano New York 25 Inch Rolling Luggage, Addie Hardshell Suitcase with Spinner Wheels, Rose Gold",Suitcases
B07TTKLV9T,Delta Sigma Theta Sorority Small Luggage Cover,Suitcases
B0C6CWMM89,"Travel Luggage Cover, 18/24/28/32 Inch, Cartoon Washable Baggage Covers (1, M (for 22-24 inch luggage))",Suitcases
B0C3B81N2W,"HHYOOSOO Full Clear Luggage Covers Luggage Protector Suitcase Cover PVC Waterproof Luggage Cover Thicken Suitcase Protector Cover Fits Most 20"" to 30"" (30 INCH)",Suitcases
B09NQXQYCD,"GinzaTravel practical PC+ABS suitcase Spinner Wheels scratch-resistant Lightweight Spinner Expandable Suitcase, luggage sets,Universal wheel (Black, 3-Piece Set(20""/24""/28""))",Suitcases
B01N6OE6VZ,"Suitcase cover luggage covers PVC clear luggage cover protector travel luggage protector covers 20"" 22"" 24"" 26"" 28"" 30''",Suitcases
B0832HSNQL,Delta Sigma Theta Large Luggage Cover,Suitcases
B0C4DWD2V5,lotus elephants Luggage Cover Suitcase Cover Washable Travel Luggage Protector Suitcase Covers M(23-26 inch luggage),Suitcases
B0BVQX1CQ2,1 Pc Luggage Cover Clear PVC Suitcase Cover Protector Travel Luggage Transparent Protective Cover Waterproof and Dustproof Luggage Suitcase Protector for Women and Men (28 Inch),Suitcases
B09J1VHCHT,Zeta Phi Beta Sorority Small Luggage Cover,Suitcases
B0BJCV9WK8,Travel Luggage Cover Gray Printed with Pocket Suitcase Cover Fits 22-25 Inch,Suitcases
B0C9PMJ3C6,"Luggage Covers for Suitcase TSA Approved - Clear Luggage Cover - Suitcase Covers for Luggage Full Coverage Luggage Protector Suitcase Cover (28"" (Black Border))",Suitcases
B0B1DGRTNR,Washable Elastic Luggage Cover Travel Suitcase Protective Cover Trunk Case Fits 18''-32'' Suitcase Protector Baggage With Concealed Zipper for Women Girls Gifts 9 Large,Suitcases
B0C1SMPWV3,"2PCS Clear PVC Suitcase Cover Protectors, Transparent Suitcase Luggage Cover, Waterproof Cover for Luggage Dustproof Luggage Sleeve Protector 20""+24"" (Black Border)",Suitcases
B09YNB4JQ6,Luggage Cover Black Women Durable Washable African American Suitcase Cover M for 22-24 Inches,Suitcases
