productId,productName,categoryName
B0BV6T9CZF,"Weojeviy 1 Pair Luggage Replacement Wheels, Outdoor Mute Double Row Large Wheel Draw‑bar Box Code Case Suitcase Accessory",Suitcases
B07J2NGJSF,"Suitcase, Multicoloured (Multicolour) - 401216900",Suitcases
B07KYZ64H3,Luggage Castaway Large Expandable Suitcase With Spinner Wheels (Royal Blue),Suitcases
B01D17K79M,"Paradiver Light Duffle with wheels 79/29, 79 cm, 121,5 L, Jeans Blue",Suitcases
B0CD45XQF1,Travel Luggage Suitcase Protector Fits 24 Inch Luggage Clear PVC Suitcase Cover Protectors for Wheeled Suitcase (24-Inch),Suitcases
B09XVB75HG,"PATIKIL Universal Luggage Protector with Fastener 22 Inch, Portable Clear PVC Antistatic Waterproof Dust Cover for Suitcase, Black",Suitcases
B0BG4SBPKG,"Luggage Cover, Protective Washable Suitcase Cover - Travel Elastic Spandex Suitcase Protector Fits 19 to 20 Inch Flower",Suitcases
B07GKL8T3X,Frontier Spinner Unisex Medium Blue Polycarbonate Luggage Bag TSA Approved Q12045002,Suitcases
B0BNP9121R,Fitness 35L Duffel,Suitcases
B08HV3ZT1Z,1 Pair Universal Luggage Wheels Double Row Suitcase Wheels Replacement for Suitcase Parts Mountaineering Tool Accessories,Suitcases
B08436RKH1,"Unisex Adult Expandable Suitcase, Chartreuse Green, Cabine (55 cm-35 L + 5 L)",Suitcases
B0B3DD8HHC,Mushroom Luggage Covers for Suitcase 22-24 Inch Travel Luggage Protector Suitcase Cover Washable Stretch Baggage Cover Hiking Camping,Suitcases
B0BX4QSLBW,Leather Trolly Luggage with Spinner Wheels - Leather Bag (Black),Suitcases
B0C9HJ8N2B,Letter D Suitcase Cover Anti-Scratch Luggage Covers Washable Travel Luggage Protector M Fit 22-24 Inch Luggage,Suitcases
B0BWXFR2BY,GSHLLO Black Luggage Cover Protector Elastic Travel Luggage Sleeve Anti Scratch Suitcase Cover Travel Accessories,Suitcases
B0C3X9WVLH,"Tropical Floral Luggage Cover Protector Colorful Hawaiian Palm Leaves Hibiscus Flowers Suitcase Covers for Luggage, Elastic Washable Travel Trunk Case Covers, Fit 22-24 Inch Suitcase",Suitcases
B0CD433RV6,Travel Luggage Suitcase Protector Fits 28 Inch Luggage Clear PVC Suitcase Cover Protectors for Wheeled Suitcase (28-Inch),Suitcases
B09XR6SV52,"SPATHA PC+ABS Hardshell Metal frame Luggage with double-wheeled spinners, checked-medium suitcase, 27 inch, Yellow, 5113-60-YE",Suitcases
B0B9S8C4ZP,"Kids Suitcase Luggage, 20"" Ride on Suitcase for Kids Horse-shaped Children Travel Luggage Suitcases with Upgrade Dual Wheel ABS Waterproof Password Lock (20 Inch Blue)",Suitcases
B01N6B52VY,Travel Luggage Cover Protector Suitcase Washable Cover High Elasticity (Speaker Small),Suitcases
B000EBMCHE,Water Tight Protective Pelicase,Suitcases
B0C4PLM97L,Travel Luggage Cover Cherry Blossom Washable Spandex Travevl Luggage Protector Baggage Suitcase Cover Apply to 18-32 Inch Travel Suitcase,Suitcases
B07KYX76MM,Designer Luggage Collection - Expandable 24 Inch Softside Bag - Durable Mid-sized Lightweight Checked Suitcase with 4-Rolling Spinner Wheels (Light Blue),Suitcases
B0C3X8GWHL,Turtle Travel Luggage Cover Protector Summer Blue Water Sea Turtle Palm Leaves Tropical Flowers Suitcase Covers for Luggage Washable Baggage Case Covers for Suitcase 25-28 Inch,Suitcases
B0C3X8GGJD,World Map Luggage Cover Protector Physical Map of The World Blue Ocean Print Suitcase Covers for Luggage Funny Elastic Washable Travel Baggage Case Covers Fits 22-24 Inch Suitcase,Suitcases
B0C3H79FVG,"3 Pieces Clear Luggage Covers for Suitcase TSA Approved PVC Waterproof Luggage Protector Suitcase Cover for Travel Packing (Black Border, 30'')",Suitcases
B0C3X874MJ,Black Woman Luggage Covers African American Woman Girl Colorful Hair with Positive Words Brown Suitcase Cover Protector Washable Travel Luggage Sleeves or Covers Fits Suitcase 18-21 Inch,Suitcases
B07CB7MG7Z,"Women's Vivian 29"" Spinner, Marble Web, One Size",Suitcases
B0BXWPV6NH,"20 24 28 Inch Luggage Covers for Suitcase, Black Frame Transparent Suitcase cover, Clear PVC Thicken Travel Luggae Protector Cover (28 Inch)",Suitcases
B0B317N74R,"Van Gogh Starry Sky Travel Luggage Protector Suitcase Cover, Washable Luggage Cover for Carry on- Fits 18-32 Inch Luggage",Suitcases
B00ODDBKFO,"Tuscany 30 Inch Expandable Vertical Rolling Luggage Case, Blue",Suitcases
B0B1MM79FK,"Vincent Van Gogh Painting Luggage Cover Protector Starry Night over The Rhone Suitcase Cover Elastic Suitcase Protective Cover Case with Zipper for Wheeled Suitcase, Washable Luggage Cover",Suitcases
B0CGMYZR3D,8Pack Suitcase Wheels Cover/Suitcase Wheel Covers - Carry on Luggage Wheels Protective Covers for most 8-spinner Wheels Luggage/Luggage Replacement for Suitcases/Office Chair - Yellow,Suitcases
B0C6XQQNTW,"Luggage Covers for Suitcase TSA Approved,Elastic Washable Suitcase Cover Protector, Dandelion Floral Luggage Cover Sleeve Wrap for 19/20/ 21 Inches Suitcase Travel Accessories",Suitcases
B0CD43KRHS,Travel Luggage Suitcase Protector Fits 20 Inch Luggage Clear PVC Suitcase Cover Protectors for Wheeled Suitcase (20-Inch),Suitcases
B07H98HDWB,FOR U DESIGNS 3D World Map Printing Leisure Travel Suitcase Cover Against Scratch L,Suitcases
B0C3X8N7BM,"Red Rose Luggage Cover Protector Roses Flowers Floral Green Leaves Black Suitcase Cover for Luggage, Fashion Printed Washable Elastic Travel Trunk Case Covers for 18-21 Inch Suitcase",Suitcases
B08YNJ25N6,Clear PVC Suitcase Cover Protectors 20 24 28 30 Inch Luggage Cover Transparent Dustproof Waterproof Luggage Cover for Carry on Luggage,Suitcases
B0C88VQBZW,1PC PVC Luggage Protector 20inch Clear Suitcase Cover Protector Waterproof 20inch Transparent Travel Luggage Covers for Wheeled Suitcase Fits Most,Suitcases
B08VWHWS9P,"2Pcs Luggage Wheels,PVC Luggage Wheels Replacement Single Roller Double Bearing, Flexible for Suitcase Accessory",Suitcases
B07CJJFDSX,1 Pair Luggage Suitcase Wheels PVC Suitcase Replacement Wheels great Accessory for Luggage Suitcase (W041-2 L),Suitcases
B0B4W9Y4XF,Tiger Printing Luggage Cover Fit 18-32 Inch Travel Business Suitcase Washable Protector Dust-proof Baggage Case,Suitcases
B079SGJN4J,"Luggage Atlantic Ultra Lite Hardsides Spinner Suitcase, Bright Violet, Checked Large 28-Inch",Suitcases
B0C3X81H6R,"Unicorn Suitcase Covers for Girls Kids, Cute Magic Unicorn Flowers Floral on Black Luggage Cover Protector Durable Elastic Suitcase Protector Travel Accessories, Fit 25-28 Inch Luggage",Suitcases
B0B4K47PHK,"Durable Anti-scratch Spandex Travel Luggage Cover Suitcase Protector Fits 22-24 Inch Luggage Blue, With Stickers",Suitcases
B08HWSLMCG,2 Pcs A52 Mute Single Row Wheel Suitcase Luggage Replacement Universal Wheel Casters Outdoor Luggage Wheels Accessories,Suitcases
B00XA67N5Q,Spree Luggage Suitcase Hardside Spinner Trolley Expandable 28¡°TSA Burgundy,Suitcases
B0BDKJWDQC,"Hardside Carry On Luggage, 20 inch 100% PC Lightweight Suitcase with Spinner Wheels TSA Lock, Silver",Suitcases
B0BZCVNY9D,"Travel Luggage Cover Suitcase Protector Washable Anti-scratch Baggage Covers(World Travel 1, XL(29-32in))",Suitcases
B084KV1G2Z,"Pursuit Aluminum Hardside Attaché (Black, Medium Attaché)",Suitcases
B0B145G7YY,"Helixian 27"" Hardside Checked 8 Wheel Expandable Spinner, Black",Suitcases
B0BJ38L7CJ,X-Bag Large Spinner with Frame - 27 Inch - Suitcases with Wheels - Checked Luggage - Sahara,Suitcases
B0B4RN9S8C,"A Pair A65 Suitcase Mute Wheel,Replacement Luggage Wheels, Durable Suitcase Wheels Swivel, Suitcase Wheel with Screw, Universal Luggage Replacement Outdoor Supplies for Repair Replacement [Small]",Suitcases
B09XHRBB9Q,Luggage Protector Suitcase Cover PVC Waterproof Travel Fits Most 20'' to 30'' (24inch),Suitcases
B0C3X96VDP,"Airplane Suitcase Covers Blue Aircraft World Map Plane Line Luggage Cover Protector with Zipper, Washable Elastic Luggage Sleeves or Covers Travel Accessories for Suitcase 29-32 Inch",Suitcases
B07TV94JPF,"Sigma 6.0 Lightweight Luggage Collection (Black, 25-Inch Spinner)",Suitcases
B0C6XP2T31,"Luggage Covers for Suitcase TSA Approved,Elastic Washable Suitcase Cover Protector, Dandelion Florals Luggage Cover Sleeve Wrap for 22/23/24/25 Inches Suitcase (M) Travel Accessories",Suitcases
B0B96M87PT,"Tefola Luggage Wheels Replacement, A65 Luggage Replacement Wheels Mute Swivel Suitcase Luggage Caster Wheels Repair Parts Suitcase Wheels Replacement Kit",Suitcases
B0B632QXCW,Luggage Cover Protector Bag PVC Clear Plastic Suitcase Cover Protectors Travel Luggage Sleeve Protector (24inch),Suitcases
B08CMR6LJY,"Luggage Cover Protective Neoprene Slip-On Sleeve - Elegant Design Suitcase Wrap for Airport Travel and Transportation - Standard Sizes, TSA Approved",Suitcases
B0B2YWJFR8,"Indio Hardside Medium Check-In (Ruby, Checked-Medium 24-Inch)",Suitcases
B072N1JV5N,"Bauer 29"" Hardside Checked Spinner Luggage, Navy, One Size",Suitcases
B0C2HQRV2L,"Expandable Luggage compartment with universal wheelse, rose gold 12 ""+20"" luggage compartment with TSA lock. Combination travel luggag",Suitcases
B0C9GLHPSW,"2 Pcs a Set, Luggage Protector Suitcase Cover PVC Bag Dust Proof Travel Suitcase with Luggage Handle Wrap By Randomly Sent",Suitcases
B08MPXX1RF,"Unisex-Adult's Suitcase, Champagne, zzzz-s",Suitcases
B0BZ57GWGS,Scripture Suitcase Cover Protector Glam Religious Bible Verse 30 Luggage Cover God Inspirational Quotes Spiritual Christian Gift For Women Faith High Fashion Motivational,Suitcases
B07GJHD9QC,2Pcs/Pack Luggage Suitcase Wheel Left and Right Luggage Suitcase Swivel Wheels Replacement Accessory for Trolley Suitcase,Suitcases
B0BHXPQ8LH,"Universal Luggage Wheel, Wheel Replacement Luggage Travel Suitcase Wheels, Caster Wheel Replacement Travel Suitcase Wheel, Plastic",Suitcases
B097GS41FP,"QUICK S Carry On Luggage, Magnesium-aluminum, Hardside with Double Spinner Wheels, 20-Inch, Quiet, TSA Lock Suitcase, Green",Suitcases
B0C4NRW37D,"Luggage Cover Travel Around Suitcase Cover Elastic Protector Sets For 18-32 Inch Suitcase Travel Accessories (A Round Trip, XL)",Suitcases
B0B595YXQ6,Skull Black Print Women Girls Luggage Cover Set Anti-thief Safety Suitcase Cover Fit 18-32 Inch Baggage,Suitcases
B095H95CZB,"PORSCHE DESIGN 21"" Spinner Carry-On Luggage - Roadster Travel Suitcase with Wheels for Men and Women - White",Suitcases
B0BZ4JKTF2,"All Aluminum Luggage Zipperless Hard Shell Suitcase (Grey, 28 inch)",Suitcases
B003F4Y6LM,Olympia Tuscany Luggage Collection,Suitcases
B0BRYCDQ43,"Suitcase Luggage Casters, 1 Pair A88 Porous Wheel Suitcase Luggage Casters Replacement for Travel Bags Large Size",Suitcases
B07K58YBCD,"Trade Dual Spinner, Night Camo, 72.0L/29-Inch",Suitcases
B0C7WHD6PP,Hztyyier 2PCS Suitcase Wheels Double Row Durable PP PET Swivel Caster Spinner Wheels Replacement Accessories for Suitcase,Suitcases
B07BK3P2LG,Travel Luggage Cover Spandex Suitcase Protector Washable Baggage Covers Suitcase Cover (XL),Suitcases
B099WTZP1P,Afro Woman Luggage Cover Black Girl Travel Suitcase Protector Elastic Protective Washable Baggage Cover With Concealed Zipper Fits M 22-24 In,Suitcases
B08F9XH53K,Aviator Pro Fusion 20 Silver Luggage – Hardside 360 Degree Wheeled Spinner Carry-On Suitcase - Aluminum Frame Polycarbonate Shell - TSA Approved Locking System,Suitcases
B0C4NQWRRF,"Luggage Cover Animals Suitcase Cover Elastic Protector Sets For 18-32 Inch Suitcase Travel Accessories (Dog & Cat, L)",Suitcases
B07GJX8D7V,Frontier Spinner Carry-On Luggage Large Purple Suitcase,Suitcases
B096MDS159,"N //A 24 Inch Transparent Luggage Cover Protector Bag, PVC Clear Plastic Suitcase Cover Protector, Travel Luggage Sleeve Protector",Suitcases
B08L28WLCS,Curiosity Pocket Metallic 4 Wheeled Rolling Luggage Metallic Glow,Suitcases
B0B7KKX5KS,"Suitcase Wheel, 1 Pair Black Luggage Suitcase Caster Swivel Universal Wheel Nylon for Repair Replacement",Suitcases
B0BPSKMH17,Travel Suitcase Covers Brown Horse Print Baggage Case Cover Protector Fit 22-24 Inch Luggage,Suitcases
B01H7D2OGK,"Luggage Set, Olive Green, set of 2",Suitcases
B07WJJFJRC,Frontier Spinner Unisex Small Black Polycarbonate Luggage Bag TSA Approved Q12009001,Suitcases
B0BJ7C1LPF,"2pcs Luggage Wheels, 360 Rotating Flexible Luggage Wheels Replacement Dual Roller Bearing Wheels for Suitcase Wheel, Luggage Replacement Wheels, Tourister Replacement Wheels, Suitcase Wheel for Travel",Suitcases
B0B89WS316,"Luggage Sets 3 Pieces with TSA Approved, Lightweight Hard Shell Travel Large Rolling Checked Suitcases with Spinner Wheels, Polypropylene Material (20/24/28), INDIGO BLUE",Suitcases
B078H6LNMP,"Denim 3D Cute cat Dog Styles Washable Print Luggage Cover Protector Suitcase Cover Carry On Cover with Zipper Fits 18-32 Inch Luggage for Holiday Travel and Great Gift Idea (Cat Yellow, L)",Suitcases
B06WD63K99,"suitcases Blue (Navy Blue), Upright S, Length 40 cm (55 cm-41 L)",Suitcases
B0C32QHPS7,Lemon Suitcase Cover Anti-Scratch Luggage Covers Washable Travel Luggage Protector XL Fit 29-32 Inch Luggage,Suitcases
B07HPDDMBG,"Unisex-Adult (Luggage only) Moraga 22"" 8-Wheel Hardside Spinner, Black",Suitcases
B002G0Z24Q,"22 Inch Wheeled Traveler, Black, One Size",Suitcases
B0BVNV4Z4M,"Voyages Hardside Luggage with Spinner Wheels, Glossy Red, 29 Inch Trunk",Suitcases
B0C3X7XLCJ,"Colorful Splashes Splatter Suitcase Cover Rainbow Splash Spots Dots on Black Luggage Covers for Suitcase, Elastic Washable Travel Luggage Protector Baggage Case Covers Fits 25-28 Suitcase",Suitcases
B08HDDFNF8,Pack of 2 Universal Luggage Suitcase Wheels Replacement for Suitcase Accessory Mountaineering Camping Supplies,Suitcases
B0C9CFKSVD,"Travel Luggage Cover Spandex Suitcase Protector Cover Suitcase Protector Trunk Washable Luggage Covers XL (Cat, XL)",Suitcases
B0C3TYK3S8,Abstract Hippie Flowers Luggage Cover for Women 2 Set Protection Cover Soft Trolley Case Grip Cover for Coworker Luggage Identifiers for Suitcases for Airport Luggage Accessories,Suitcases
B00UKFB6C6,"Vantage Slate Blue 30 Inches Suitcase, Slate Blue",Suitcases
B0C1Y71MJM,"LC LICTOP Luggage Protector Suitcase Cover 22Inch PVC Waterproof Travel Suitcase Cover,Clear and Black Edging 1pc",Suitcases
B0BXX8SMFD,Suitcase Cover Luggage Covers Protective Protector Personalized luggage cover for Travel Suit case 26-28Inch Blue Sky,Suitcases
B0B1J1W4LT,Colorful Boho Flower Print Luggage Cover Anti-Scratch Dustproof Suitcase Protector Covers Washable High Elastic Baggage Covers Fits 30-32 Inch Luggage,Suitcases
B07HPG5GYG,"Unisex-Adult (Luggage only) Moraga 26"" 8-Wheel Hardside Spinner, Black",Suitcases
B0BMG2QDJT,Suitcase Covers For Boys Girls Cartoon Panda Print Waterproof Dirt-proof Cute Travel Luggage Protector Cover,Suitcases
B0BB8JKLHV,Tranverz XXS - Black Denim,Suitcases
B0BZXRJF9V,"Pure Pink Suitcase Cover - Waterproof Stretch Travel Luggage Cover, Simple Solid Color Luggage Covers Washable Luggage Protector Suitcase Cover Fits 22-25 Inch Luggage",Suitcases
B0CC9WGWR2,Luggage Suitcase Wheels 1 Pair Luggage Replacement Wheels Mute Swivel Suitcase Luggage Caster Wheels Repair Parts,Suitcases
B01N39F8B4,"Spandex Luggage Medium Suitcase Cover, Zebra",Suitcases
B008DFJOEM,"Luggage Set, Green, set of 3",Suitcases
B07HPFLZRX,"Unisex-Adult (Luggage only) Moraga 22"" 8-Wheel Hardside Spinner, Red",Suitcases
B0BZRT2F9X,"Suitcase Cover, TPU Luggage Cover 24 Inch Luggage Protectors for Wheeled Suitcase (24""(21.7"" H x 16.7"" L x 10.8"" W))",Suitcases
B008G3Z29M,"Luggage Titan 29 Inch Expandable Spinner, Black, One Size",Suitcases
B0B2YBV58Q,"Wave Hardside Spinner Luggage, Black/Blue, Check in",Suitcases
B083NX2RDW,"Luggage Set, Coral, Set of 3",Suitcases
B0721L9N3P,"Bauer 21"" Hardside Carry-on Spinner Luggage, Black, One Size",Suitcases
B0CCDHRKG3,"Travel Painting Travel Luggage Cover Suitcase Protector,Luggage Handle Wrap/Tags/Identifiers,Universal Suitcase Cup Holder Luggage Cup Holder Attachment Travel Free Hand Drink Caddy",Suitcases
B07W153N6F,America EcoLite 26-Inch Hardside Spinner Luggage (Charcoal),Suitcases
B0BHS2CZ38,Neon American Flag Bold Eagle Luggage Cover Heavy Duty Travel Suitcase Protector Washable Anti Scratch Luggage Protector Fits 26-28Inch,Suitcases
B0BWJT84FZ,"Travel Luggage Cover, Elephant Mandala Flower Patten Blue Red Spandex Elastic Suitcase Cover Protector, Washable Scratch-Resistant Suitcase Cover Fits 18-32 Inch Luggage",Suitcases
B0BKQ3WPXT,"Spinner Travel Upright Luggage Hereford, White, 4-Wheel 28",Suitcases
B072N1JWSC,"Delancey II 29"" Hardside Checked Spinner Luggage, Silver",Suitcases
B01LZDHWX3,"Samsonite Base Boost - Spinner S (Length: 40 cm) Hand Luggage, 55 cm, 39 Litre, Blue (Petrol Blue)",Suitcases
B07ZFJ4YWM,18/20/24/25/26/28/29/30/31/32 Inch Creative Pink Color Eiffel Tower 3D Printed Luggage Cover Spandex Travel Suitcase Protective Cover,Suitcases
B09XR6KF69,"Aluminum frame, Durable Hardside Japanese luggage, double spinner wheels, checked-large suitcase, 30 inch, Silver Carbon, 5507-70-SLCB",Suitcases
B09D35X238,"Rose Glod Luggage Covers for Suitcase Protector Fits 18-32 Inch Luggage Tsa Approved Washable Anti-scratch Pink Floral Leaf Travel Suitcase Cover(XL,29-32inch)",Suitcases
B00X9YC19M,"Suitcase, Burgundy, 65cm",Suitcases
B083NWS5CQ,"Suitcase, Coral, 75cm/29.7""",Suitcases
B07BV3TTWJ,"Hand Luggage, Black (Black), Spinner XL (78 cm-117.5 Litre)",Suitcases
B0B42CV2X8,Suitcase Covers for Luggage Travel Fashion Skull Floral Print Carry on Luggage Cover Protector for Women for 18-32 inch Luggage,Suitcases
B007AU7R4K,"Hand Luggage, Green, 55cm",Suitcases
B0BY8GPM1Y,Travel Luggage Cover Cute Dinosaur Children Cartoon Cactus Pink Girl Anti-Scratch Luggage Protector Personalized Suitcase Cover Washable Suitcase Protector with Concealed Zipper Fits 29-32in Luggage,Suitcases
B0742PMZBZ,"Ziplite 3.0, 20in Carry-on, Hardside Spinner Luggage telescoping_handle(Deep Purple)",Suitcases
B0C7RPQCM7,Belidome Camera Pattern Luggage Handle Wraps Suitcase Protective Cover Trolley Case Grip Cushion Car Roof Grab Handle Covers Travel Decorative Accessories Set of 2,Suitcases
B0C4QLMZ8H,"Cabin Luggage Carry On 20"" with Front Compartment & Expandable, ABS+PC Suitcase with Dual Control TSA Lock, YKK Zipper, 4 Silent Wheels, Dark Green",Suitcases
B07MNGPLWT,FTVOGUE 22in / 26in / 28in / 30in PVC Transparent Dust-Proof Luggage Suitcase Cover Waterproof Trolley Case Protector(28in),Suitcases
B0BY84X273,"2Pcs Swivel Suitcase Luggage Replacement Wheels, 360 Swivel Wheel Replacement Luggage Travel Suitcase Wheels Plastic, Luggage Swivel Wheel Replacement",Suitcases
B0C2HPD1Q4,"Hardside Expandable Luggage with Spinner Wheels, 20/24-Inch Hard Suitcasees with TSA Lock (Carry-On 20-Inch)",Suitcases
B0BZ56V5LV,Family Suitcase Protector Inspirational Quotes Scripture Bible Verse Hand Carry Luggage Cover Catholic Christian Gift For Women Religious Spiritual Positive Saying God,Suitcases
B09CFXX2M8,"Suitcase Cover Protectors World Famous Monuments Travel Luggage Cover Spandex Suitcase Protector Washable Baggage Covers (S (for 18-21 inch luggage), Go Travel)",Suitcases
B0BWJV8GNN,"Travel Luggage Cover, Solid Color Khaki Spandex Elastic Suitcase Cover Protector, Washable Scratch-Resistant Suitcase Cover Fits 18-32 Inch Luggage",Suitcases
B07PB5X36N,"Hardside Spinner Luggage, Rose Gold GA, Carry-On 20-Inch",Suitcases
B0C1Y4RBSQ,"LC LICTOP Luggage Protector Suitcase Cover 20Inch PVC Waterproof Travel Suitcase Cover,Clear and Black Edging 1pc",Suitcases
B0CC2395JN,Beach Bag Waterproof Sand Resistant Women's Tote Pool Bag with Zipper for Gym Groceries Travel with Wet Pockets,Suitcases
B07VQFM7FW,"Travel Luggage Suitcase Cover - Protector for Luggage Suitcase (XL) - Don't Touch My Suitcase, White/Black",Suitcases
B01ET5ETSA,"Forte Hardside Spinner Check in Luggage 29"", Silver, One Size",Suitcases
B07ZPMYGNM,"Fieldbrook XLT Softside Upright Luggage, Red/Black, Checked-Medium 25-Inch",Suitcases
B00W66LQFO,Men's Eversoft Cotton Stay Tucked Crew T-Shirt,Men's Clothing
B0C4RMF5PZ,Official Renaissance World Tour Merch Disco Cowboy Hat T-Shirt,Men's Clothing
B01ABVLOHA,"Performance Lightweight Crew Training Socks (3 Pair) (Medium, White/Black)",Men's Clothing
B086KSDTQ4,"Men's Boxer Briefs, Soft and Breathable Cotton Underwear with ComfortFlex Waistband, Multipack",Men's Clothing
B09LLW2Q4R,"Hooded Rain Poncho for Adult with Pocket, Waterproof Lightweight Unisex Raincoat for Hiking Camping Emergency",Men's Clothing
B07FKG7W63,Unisex Everyday Cushion Crew 3 Pair,Men's Clothing
B010RWDJOY,Performance Cushion Crew Socks with Band (6 Pairs),Men's Clothing
B0059CVERW,6 Pack Sports Dri-Fit Moisture Wicking Athletic Crew Socks Red Yellow Blue Green Purple Orange White,Men's Clothing
B07SP8CG3P,Dri-Fit Training Cotton Cushioned Crew Socks 6 PAIR Black with White Signature Swoosh Logo) LARGE 8-12,Men's Clothing
B077ZMKWVM,"Men's Crew T-Shirts, Multipack, Style G1100",Men's Clothing
B0959VZL78,"Nxtrnd XTD Scrunch Football Socks, Extra Long Padded Sport Socks for Men & Boys",Men's Clothing
B099Q21865,"Elite Basketball Socks,running socks,Athletic Socks,Compression Cushion Socks for Men & Women",Men's Clothing
B00KK6M7ZU,"Men's Bag Cotton Quarter Cut Socks (6 Pack) (Large (shoe size 8-12), White)",Men's Clothing
B07BR4DWHG,Everyday Cushion Crew Socks,Men's Clothing
B07PH2VWX1,"Men's Coolzone Boxer Briefs, Moisture Wicking & Breathable, Assorted Color Multipacks",Men's Clothing
B0BJZ8WJ86,Tees Premium Fitted Men's T-Shirts - Crew Neck,Men's Clothing
B07KWRXSZR,Ultra-lite2 Waterproof Breathable Poncho,Men's Clothing
B09ZCDYPR6,Mens 3 Pack Fleece Active Athletic Workout Jogger Sweatpants for Men with Zipper Pocket and Drawstring Size S-3XL,Men's Clothing
B08GPDY3CY,Oakleys LEGACY FOOTBALL SHIELD,Men's Clothing
B08GZL48D9,"Men's Tag-Free Boxer Shorts, Relaxed Fit, Moisture Wicking, Assorted Color Multipacks",Men's Clothing
B01D2GRTIE,Men's Multi-Pack Mesh Ventilating Comfort Fit Performance No-Show Socks,Men's Clothing
B00Y0NGBSS,"Men's Double Tough Crew Socks, 12-Pair Pack",Men's Clothing
B07VF6N878,"mens 12 Pair Pack Dual Defense Cushioned Casual Sock, Black, 6-12",Men's Clothing
B08YW38K6W,"Men's Soccer Socks Anti Slip Non Slip Grip Pads for Football Basketball Sports Grip Socks, 4 Pair B0BDF3FTVL",Men's Clothing
B00JUM4CT4,"Men's Hoodie, EcoSmart Fleece Zip-Front Hooded Sweatshirt, Cotton-Blend Fleece Hooded Sweatshirt, Mid-Weight Zip-Up",Men's Clothing
B07SXCW5RQ,"Adult Performance Tech No Show Socks, Multipairs",Men's Clothing
B07L54C3Y1,Men's Cotton Classics 5-Pack Boxer Brief,Men's Clothing
B008M5S09S,Men's Dri-tech Moisture Control Crew Socks Multipack,Men's Clothing
B09JFR8HTV,Men's Dress Shirts Solid Long Sleeve Stretch Wrinkle-Free Formal Shirt Business Casual Button Down Shirts,Men's Clothing
B00IO9H6GU,"Men`s Ankle Socks, 186V12,12-Pack, 10-13, White (Shoe Size 6-12)",Men's Clothing
B01E1B02G0,"LUX Anti Slip Soccer Socks,Non Slip Football/Basketball/Hockey Sports Grip Pads Socks…",Men's Clothing
B086L77BVP,Mens Tagless Boxer With Exposed Waistband Multi-Packs,Men's Clothing
B08JGBB9N1,Athletic Shorts for Men with Pockets and Elastic Waistband Quick Dry Activewear,Men's Clothing
B00K5CVSLI,Everyday Cushion Ankle Training Socks (6 Pair),Men's Clothing
B00W80Z87K,Men's Tag-Free Tank A-Shirt,Men's Clothing
B01K995XPI,Arm Sleeves,Men's Clothing
B00D1ARZMC,"Men's Undershirts, Odor Control, Moisture-Wicking Tee Shirts, Multi-Packs",Men's Clothing
B00AECT1ZE,Men's Dri-tech Moisture Control Quarter Socks Multipack,Men's Clothing
B01J4MF53Q,Modern,Men's Clothing
B0785MTQDS,Everyday Plus Cushion Crew Socks 3-Pair Pack,Men's Clothing
B09R82W413,Men's Total Support Pouch Boxer Brief,Men's Clothing
B01M3RYHP0,Men's Tag-Free Cotton Briefs,Men's Clothing
B09ZBGXRQR,"Everyday Cotton Cushioned Crew Socks (6 Pack) (Large, White/Black)",Men's Clothing
B0BC3F17K8,8 Pairs Compression Socks for Men & Women 20-30 mmHg Knee High Nurse Pregnant Running Medical and Travel Athletic,Men's Clothing
B07P7M18C6,Energy Unisex Easy-On/Easy-Off Knee High Compression Socks,Men's Clothing
B07FKFHTF7,Everyday Cushion Ankle Training Socks (3 Pair),Men's Clothing
B007GJQHTQ,Men's Athletic Cushioned Low Cut Socks with Arch Compression for a Secure Fit (6-Pair),Men's Clothing
B00LSRU1QW,Men's Tagless Cotton V-Neck Undershirt – Multiple Pack and Color,Men's Clothing
B07F282SF7,"Men's Performance Cotton Cushioned Athletic Ankle Socks, 6 Pairs",Men's Clothing
B07Q2VMXQ2,"MYS Men's 3 Piece Slim Fit Suit Set, One Button Solid Jacket Vest Pants with Tie Natural White",Men's Clothing
B00A219DL4,Men's Wild Cargo Pants,Men's Clothing
B014RQ1L1O,"Adult Fleece Hoodie Sweatshirt, Style G18500, Multipack",Men's Clothing
B00CAXS3LS,"Men's Boxers 5-Pack, Cotton Knit Comfortable Boxer Underwear, Moisture-Wicking Cotton Boxers Multipack",Men's Clothing
B008YA0ZO4,Men's Athletic Cushioned Quarter Socks (with Arch Compression for a Secure Fit (6-Pair),Men's Clothing
B09FCBZ4YK,"Men's Underwear Boxer Briefs, Cotton Stretch Moisture-Wicking Underwear, Multi-pack",Men's Clothing
B010RWD4GM,"Unisex Performance Cushion Crew Socks with Band (6 Pairs), Black/White, Large",Men's Clothing
B0B7NWWV3X,"Men's Max Cushioned Crew Socks, Moisture-Wicking with Odor Control, Multi-Pack, White/Grey Foot Bottom-12, 6-12",Men's Clothing
B07JD592BB,"Men's A-Shirt Tanks, Multipack, Style G1104",Men's Clothing
B07PGR1XGZ,Men's Cotton Stretch 7-Pack Boxer Brief,Men's Clothing
B07NNTCV5K,Men's 8 Pack Low Cut Socks,Men's Clothing
B086L316XC,"Men's Boxer Briefs, Cool Comfort Moisture-Wicking Breathable Underwear, Multi-Pack",Men's Clothing
B00HVVVMM6,"Men's Pack, Moisture-Wicking Ribbed, Lightweight Cotton Tank Undershirts, 6-Pack",Men's Clothing
B00VTVCR3C,Men's Eversoft Cotton Stay Tucked V-Neck T-Shirt,Men's Clothing
B06XW6TLBH,"Men's Tank Undershirts, Pack of 6",Men's Clothing
B01MEHHVTO,Men's Sportstyle Tricot Joggers,Men's Clothing
B01K0ETB6E,Men's Buck Camp Flannel Plaid Shirt,Men's Clothing
B0959LKFTH,"Nxtrnd Football Leg Sleeves, Calf Sleeves for Men & Boys, Sold as a Pair",Men's Clothing
B077ZN2F83,"Men's V-Neck T-Shirts, Multipack, Style G1103",Men's Clothing
B07MCPYYKK,"Plus Cushion Socks (6-Pair) (L (Men's 8-12 / Women's 10-13), Crew Black) (Large, Black)",Men's Clothing
